{"$defs":{"identity":{"additionalProperties":false,"properties":{"entity":{"minLength":1,"type":"string"},"id":{"minLength":1,"type":"string"}},"required":["entity","id"],"type":"object"},"json":{"anyOf":[{"type":["null","boolean","integer","string"]},{"items":{"$ref":"#/$defs/json"},"type":"array"},{"additionalProperties":{"$ref":"#/$defs/json"},"type":"object"}]}},"$id":"https://behavior-ir.org/schema/invocation-record-0.1.schema.json","$schema":"https://json-schema.org/draft/2020-12/schema","additionalProperties":false,"properties":{"behavior_version":{"pattern":"^sha256:[0-9a-f]{64}$","type":"string"},"binding_facts":{"items":{"additionalProperties":false,"properties":{"expected":{"type":"string"},"param":{"type":"string"},"requested":{"$ref":"#/$defs/identity"},"status":{"enum":["bound","unknown","wrong_type"]}},"required":["param","expected","requested","status"],"type":"object"},"type":"array"},"capability":{"type":["string","null"]},"context":{"$ref":"#/$defs/json"},"data_version":{"type":["string","null"]},"format":{"const":"behavior.invocation_record.v1"},"input":{"$ref":"#/$defs/json"},"intent_metadata":{"additionalProperties":{"$ref":"#/$defs/json"},"type":"object"},"kind":{"enum":["action","read",null]},"outcome":{"oneOf":[{"additionalProperties":false,"properties":{"decode_evidence":{"additionalProperties":{"$ref":"#/$defs/json"},"type":"object"},"kind":{"const":"pre_evaluation_refusal"},"problems":{"items":{"additionalProperties":false,"properties":{"code":{"minLength":1,"type":"string"},"expected":{"type":"string"},"message":{"type":"string"},"param":{"type":"string"},"path":{"type":"string"},"reason":{"minLength":1,"type":"string"},"requested":{"$ref":"#/$defs/identity"},"stage":{"enum":["DECODE","BINDING"]}},"required":["stage","code","path","message"],"type":"object"},"minItems":1,"type":"array"},"stage":{"enum":["DECODE","BINDING"]}},"required":["kind","stage","problems"],"type":"object"},{"additionalProperties":false,"properties":{"kind":{"const":"evaluated"},"record":{"additionalProperties":{"$ref":"#/$defs/json"},"type":"object"},"record_id":{"minLength":1,"type":"string"},"record_kind":{"enum":["decision","read"]}},"required":["kind","record_kind","record_id","record"],"type":"object"}]},"record_id":{"pattern":"^invocation:sha256:[0-9a-f]{64}$","type":"string"},"requested_bindings":{"$ref":"#/$defs/json"},"schema":{"pattern":"^sha256:[0-9a-f]{64}$","type":"string"}},"required":["format","record_id","capability","kind","behavior_version","schema","data_version","requested_bindings","input","context","binding_facts","outcome"],"title":"behavior.invocation_record.v1","type":"object"}
