{"behavior_version":"sha256:411b114844d326332f5616343cef86972d1fd1afeffc5a5c38fd8fa8939fdb47","binding_facts":[{"expected":"Account","param":"from_","requested":{"entity":"Account","id":"a1"},"status":"bound"},{"expected":"Account","param":"to","requested":{"entity":"Account","id":"a2"},"status":"bound"}],"capability":"transfer","context":{},"data_version":"test:1","format":"behavior.invocation_record.v1","input":{"amount":20},"kind":"action","outcome":{"kind":"evaluated","record":{"action":{"hash":"sha256:6d134e02bb9afd9c9985642fb1eb68a86b607183051493ee72d6722c0af70a70","name":"transfer"},"behavior_version":"sha256:411b114844d326332f5616343cef86972d1fd1afeffc5a5c38fd8fa8939fdb47","changes":[{"entity":"Account","field":"balance","id":"a1","new":80,"old":100,"param":"from_"},{"entity":"Account","field":"balance","id":"a2","new":70,"old":50,"param":"to"}],"context":{},"data_version":"test:1","derived":[],"input":{"amount":20},"reasons":[],"record_version":"0.4","result":"ALLOW","state":{"from_":{"balance":100,"id":"a1","owner":"c1"},"to":{"balance":50,"id":"a2","owner":"c2"}},"trace":[{"expr_text":"a.balance >= 0","hash":"sha256:d3134e9be3f3a5cae2de5bb3205cca1738eeb675d2c52cb4275bcd3a60d7b3e0","loc":{"file":"ledger","line":1},"name":"balance_nonnegative","outcome":true,"param":"from_","phase":"constraint","reads":{"a.balance":100},"role":"state"},{"expr_text":"a.balance >= 0","hash":"sha256:d3134e9be3f3a5cae2de5bb3205cca1738eeb675d2c52cb4275bcd3a60d7b3e0","loc":{"file":"ledger","line":1},"name":"balance_nonnegative","outcome":true,"param":"to","phase":"constraint","reads":{"a.balance":50},"role":"state"},{"expr_text":"amount >= 0","hash":"sha256:56504107d4e6de19d664628822b18a67f68cfa68d579456c4bb94a8d19e8f652","loc":{"file":"ledger","line":1},"outcome":true,"phase":"precondition","reads":{"amount":20}},{"expr_text":"from_.balance >= amount","hash":"sha256:5f52a242f1d77c13b254a1dd209eb0548b99515fe939fbc55546bd35aea23ad0","loc":{"file":"ledger","line":1},"outcome":true,"phase":"precondition","reads":{"amount":20,"from_.balance":100}},{"expr_text":"to.balance <= 9223372036854775807 - amount","hash":"sha256:e1652610171727224573db3ffe88b58966349eae36897d79fa390a06d156e5a2","loc":{"file":"ledger","line":1},"outcome":true,"phase":"precondition","reads":{"amount":20,"to.balance":50}},{"expr_text":"from_.balance := from_.balance - amount","hash":"sha256:5c05af86146d524580b7749b39e67e38fd8ca21ca3cf0681656461e739d3702c","loc":{"file":"ledger","line":1},"outcome":{"assigned":80},"phase":"effect","reads":{"amount":20,"from_.balance":100}},{"expr_text":"to.balance := to.balance + amount","hash":"sha256:2b89cb9b324d6bfc6f7053098d65df786f80b7dcf689c26f13c72b2e1a557007","loc":{"file":"ledger","line":1},"outcome":{"assigned":70},"phase":"effect","reads":{"amount":20,"to.balance":50}},{"expr_text":"a.balance >= 0","hash":"sha256:d3134e9be3f3a5cae2de5bb3205cca1738eeb675d2c52cb4275bcd3a60d7b3e0","loc":{"file":"ledger","line":1},"name":"balance_nonnegative","outcome":true,"param":"from_","phase":"constraint_post","reads":{"a.balance":80}},{"expr_text":"a.balance >= 0","hash":"sha256:d3134e9be3f3a5cae2de5bb3205cca1738eeb675d2c52cb4275bcd3a60d7b3e0","loc":{"file":"ledger","line":1},"name":"balance_nonnegative","outcome":true,"param":"to","phase":"constraint_post","reads":{"a.balance":70}}]},"record_id":"sha256:95ac70d539f919ea2cb969b78ab371de77f0a9a001b35303135ff34cce39f29f","record_kind":"decision"},"record_id":"invocation:sha256:8426de5244faf75f2b5e1da89732f79bc2f170f7ac00b805f143e9938ba6be99","requested_bindings":{"from_":{"entity":"Account","id":"a1"},"to":{"entity":"Account","id":"a2"}},"schema":"sha256:a4299ca427dc2d16055e7c0619420da9c6784cf5f4d927d35f55bf832fd945c3"}