{"behavior_version":"sha256:239704ca0c6adb178678928ccff28a30cc442a56de7fab4a983cd4cd0111b6ef","binding_facts":[{"expected":"Culture","param":"c","requested":{"entity":"Culture","id":"missing"},"status":"unknown"}],"capability":"inspect","context":{},"data_version":"store:sha256:dafa8366a7e90e6eeb51868c7f54ff5fcc65c6abd1deb86f5d10e3d5d5dcf496;state:sha256:d183f5f766154fc5eaba444897e74b990f80da32dc41ea7cd052d494c8218e2c;position:0","format":"behavior.invocation_record.v1","input":{},"kind":"read","outcome":{"kind":"pre_evaluation_refusal","problems":[{"code":"INVALID_BINDING","expected":"Culture","message":"binding `c`: UNKNOWN_BINDING","param":"c","path":"bindings.c","reason":"UNKNOWN_BINDING","requested":{"entity":"Culture","id":"missing"},"stage":"BINDING"}],"stage":"BINDING"},"record_id":"invocation:sha256:22a0096a759585437bca74a085cdacc582e23f9394ee7458d0c98ed93579a616","requested_bindings":{"c":{"entity":"Culture","id":"missing"}},"schema":"sha256:ed4d12e315406c899d08cf0278c4d792f2bb34bcc38b0ff3757bc21cd8f26ba8"}