{"behavior_version":"sha256:411b114844d326332f5616343cef86972d1fd1afeffc5a5c38fd8fa8939fdb47","binding_facts":[{"expected":"Customer","param":"customer","requested":{"entity":"Account","id":"a1"},"status":"wrong_type"}],"capability":"suspend_customer","context":{},"data_version":"test:1","format":"behavior.invocation_record.v1","input":{},"kind":"action","outcome":{"kind":"pre_evaluation_refusal","problems":[{"code":"INVALID_BINDING","expected":"Customer","message":"binding `customer`: WRONG_ENTITY_TYPE","param":"customer","path":"bindings.customer","reason":"WRONG_ENTITY_TYPE","requested":{"entity":"Account","id":"a1"},"stage":"BINDING"}],"stage":"BINDING"},"record_id":"invocation:sha256:65c51ea046552c1e3b7609aee3aa54dd134e7da9fe57d2d519e4a30a5836b86d","requested_bindings":{"customer":{"entity":"Account","id":"a1"}},"schema":"sha256:a4299ca427dc2d16055e7c0619420da9c6784cf5f4d927d35f55bf832fd945c3"}