{"behavior_version":"sha256:da2243723e074b2c4fb098fbdd4ea5deb7f1902d18f3027cafa435bf8b895d17","binding_facts":[{"expected":"Counter","param":"c","requested":{"entity":"Counter","id":"c1"},"status":"bound"}],"capability":"refusal","context":{},"data_version":"store:sha256:3a1160ca52e6ece7fea00fc4adcf4b0452e5dc876e34adc8afd0e6a5b1ad4a4e;state:sha256:8b5ba18dd618cf903689efc3aa29cb5019717a89952ab5df16438c9487bb46e6;position:0","format":"behavior.invocation_record.v1","input":{},"kind":"action","outcome":{"kind":"evaluated","record":{"action":{"hash":"sha256:9d463b34a9b2a6540f524fccedf01db99bf55417a2239d948c291f6dcd44e75e","name":"refusal"},"behavior_version":"sha256:da2243723e074b2c4fb098fbdd4ea5deb7f1902d18f3027cafa435bf8b895d17","changes":[],"commands":{"declarations":[],"intents":[],"types":[]},"context":{},"data_version":"store:sha256:3a1160ca52e6ece7fea00fc4adcf4b0452e5dc876e34adc8afd0e6a5b1ad4a4e;state:sha256:8b5ba18dd618cf903689efc3aa29cb5019717a89952ab5df16438c9487bb46e6;position:0","derived":[],"facts":{"universe":[{"entity":"Counter","members":[{"id":"c1","value":7}]}]},"input":{},"reasons":[{"code":"PRECONDITION_FAILED"}],"record_version":"0.7","result":"DENY","semantic_profile":"0.8","state":{"c":{"id":"c1","value":7}},"trace":[{"hash":"sha256:8159d64cd7d78d49d71c10140d6365566e8cad810d7813edfd9a4c101a74ecc7","outcome":false,"phase":"precondition","reads":{}}]},"record_id":"sha256:c7214f8c790044c2f60cb323358970116214764c5eb7e6e05370503b2360d395","record_kind":"decision"},"record_id":"invocation:sha256:3b63b1855c1148da8d34a0cbfefddfc1f139dfb2d79487918847ae9e7f9f1e3a","requested_bindings":{"c":{"entity":"Counter","id":"c1"}},"schema":"sha256:49a2d28793ade376d1dbe0911832cfd9331abc8eaddc6cd6e3fc1986e32db6fd"}