{"behavior_version":"sha256:411b114844d326332f5616343cef86972d1fd1afeffc5a5c38fd8fa8939fdb47","binding_facts":[{"expected":"Customer","param":"customer","requested":{"entity":"Customer","id":"c1"},"status":"bound"}],"capability":"suspend_customer","context":{},"data_version":"test:1","format":"behavior.invocation_record.v1","input":{},"kind":"action","outcome":{"kind":"evaluated","record":{"action":{"hash":"sha256:7442817af3a928d8f0a36ffa53bc3f325624583a0b206780c1a1e4048b241976","name":"suspend_customer"},"behavior_version":"sha256:411b114844d326332f5616343cef86972d1fd1afeffc5a5c38fd8fa8939fdb47","changes":[{"entity":"Customer","field":"status","id":"c1","new":"SUSPENDED","old":"ACTIVE","param":"customer"}],"context":{},"data_version":"test:1","derived":[],"input":{},"reasons":[],"record_version":"0.4","result":"ALLOW","state":{"customer":{"id":"c1","name":"Ada","status":"ACTIVE"}},"trace":[{"expr_text":"customer.status := Status.SUSPENDED","hash":"sha256:254ae2bf5f173f0926fdaf5042f918d2ee40f0225a86d033f2f53f1edfc1a142","loc":{"file":"ledger","line":1},"outcome":{"assigned":"SUSPENDED"},"phase":"effect","reads":{}}]},"record_id":"sha256:b352e65dc46a7778ac70849d4e65dc7555bd096cb607a32e53f612d7047084e2","record_kind":"decision"},"record_id":"invocation:sha256:aacb00cdcc6162ef910c040b43cd3fa777d273e75be1e969ae6aaa927de1f65d","requested_bindings":{"customer":{"entity":"Customer","id":"c1"}},"schema":"sha256:a4299ca427dc2d16055e7c0619420da9c6784cf5f4d927d35f55bf832fd945c3"}